榜单名,榜单名简短
2018中国大数据企业50强名单,中国大数据企业50强
2018年（第17届）中国软件业务收入前百家企业,中国软件业务收入前百家企业
2019年（第18届）中国软件业务收入前百家企业,中国软件业务收入前百家企业
2022中国房地产企业综合实力TOP100,中国房地产企业综合实力100强
2022中国房地产百强企业榜,中国房地产百强企业
2022全球资管500强,全球资管500强
2022年信托公司行业评级A类公司榜单,信托公司行业评级A类公司
2022最具价值品牌榜,最具价值品牌
2023中国VR50强企业,中国VR50强企业
2023中国交通枢纽物业服务领先企业,中国交通枢纽物业服务领先企业
2023中国产业园区物业服务领先企业,中国产业园区物业服务领先企业
2023中国住宅物业服务领先企业,中国住宅物业服务领先企业
2023中国公众物业服务领先企业,中国公众物业服务领先企业
2023中国写字楼物业服务领先企业,中国写字楼物业服务领先企业
2023中国医院物业服务领先企业,中国医院物业服务领先企业
2023中国品质物业服务领先企业,中国品质物业服务领先企业
2023中国商业物业服务领先企业,中国商业物业服务领先企业
2023中国大数据企业50强名单,中国大数据企业50强
2023中国学校物业服务领先企业,中国学校物业服务领先企业
2023中国智慧物业服务领先企业,中国智慧物业服务领先企业
2023中国物业城市服务领先企业,中国物业城市服务领先企业
2023中国物业增值服务运营领先企业,中国物业增值服务运营领先企业
2023中国物业服务企业综合实力500强,中国物业服务市场化运营领先企业
2023中国物业服务市场化运营领先企业,中国物业服务市场化运营领先企业
2023中国物业服务成长性领先企业,中国物业服务成长性领先企业
2023中国物业社会责任贡献领先企业,中国物业社会责任贡献领先企业
2023中国行政办公物业服务领先企业,中国行政办公物业服务领先企业
2023年IRN100榜单前十名租赁公司,IRN100前十名租赁公司
2023年中国房地产企业稳健经营榜,中国房地产企业稳健经营100强
2023年中国房地产企业重振榜,中国房地产企业重振100强
2024 城际高铁和轨道交通建设企业 TOP50,城际高铁和轨道交通建设企业50强
2024VR50强企业,VR50强企业
2024中国软件企业150强名单,中国软件企业150强
2024全球保险品牌价值100强排行榜,全球保险品牌价值100强
2024年中国保险公司市场价值排行榜,中国保险公司市场价值
2024年中国物业服务企业500强优选服务商智慧物业领域品牌,中国物业服务企业500强优选服务商智慧物业领域品牌
2024年中国银行业前100名单,中国银行业前100强
2024年信托公司利润总额榜单,信托公司利润总额
2024年度中国医药工业主营业务收入前100位企业,中国医药工业主营业务收入100强
2024年度中国医药工业百强榜,中国医药工业百强
2024年度技术公司100强榜单,技术公司100强
2025 《财富》中国 500 强排行榜,《财富》中国500强
2025 中国房地产百强企业,中国房地产百强企业
2025 全球汽车零部件配套供应商百强榜,全球汽车零部件配套供应商百强
2025 全球独角兽榜,全球独角兽
2025 福布斯中国人工智能科技企业 TOP 50,福布斯中国人工智能科技企业50强
2025 福布斯中国人工智能科技企业 TOP 50 评选,福布斯中国人工智能科技企业50强
2025中国CDMO企业TOP20,中国CDMO企业20强
2025中国化药研发实力TOP50,中国化药研发实力50强
2025中国生物药研发实力排行榜TOP50,中国生物药研发实力50强
2025中国药品研发综合实力TOP100,中国药品研发综合实力100强
2025中国药品研发综合实力排行榜TOP100,中国药品研发综合实力100强
2025中国金融科技竞争力TOP100,中国金融科技竞争力100强
2025全国高新区盈利能力百强榜单,全国高新区盈利能力百强
2025全球汽车零部件配套供应商百强榜,全球汽车零部件配套供应商百强
2025全球海运货代50强榜单中的中国企业,全球海运货代50强中的中国企业
2025全球海运货代前十位,全球海运货代前十位
2025全球资管500强,全球资管500强
2025年CNPP上市公司行业十大品牌榜中榜名录,CNPP上市公司行业十大品牌
2025年CNPP中华老字号行业十大品牌榜中榜名录,CNPP中华老字号行业十大品牌
2025年CNPP软件开发公司行业十大品牌榜中榜名录,CNPP软件开发公司行业十大品牌
2025年《财富》中国500强净利润率TOP10,《财富》中国500强净利润率10强
2025年《财富》中国500强净资产收益率（ROE）TOP10,《财富》中国500强净资产收益率（ROE）10强
2025年《财富》中国500强排行榜,《财富》中国500强
2025年《财富》中国500强榜单,《财富》中国500强
2025年中国区块链行业重点企业核心竞争力排名,中国区块链行业重点企业核心竞争力
2025年二季度末公募机构非货规模前十名,公募机构非货规模50强
2025年十大软件开发公司排行榜,十大软件开发公司
2025年第二季度末公募机构非货规模第11位-20位,公募机构非货规模50强
2025年第二季度末公募机构非货规模第21位-30位,公募机构非货规模50强
2025年第二季度末公募机构非货规模第31位-40位,公募机构非货规模50强
2025年第二季度末公募机构非货规模第41位-50位,公募机构非货规模50强
2025年财富中国500强榜单,财富中国500强
2025福布斯中国人工智能科技企业TOP50,福布斯中国人工智能科技企业50强
专精特新小巨人,专精特新小巨人
中国交通500强,中国交通500强
中国房地产品牌价值排行榜前十名,中国房地产品牌价值前十名
中国房地产百强企业榜单,中国房地产百强企业
中国最好的期货公司,中国最好的期货公司
中国物业服务企业综合实力500强,中国物业服务企业综合实力500强
中国金融科技竞争力2024年百强榜单,中国金融科技竞争力100强
中国金融科技竞争力TOP100,中国金融科技竞争力100强
中国银行业100强榜单,中国银行业100强
全国融资租赁企业50强排名,全国融资租赁企业50强
全球区块链50强榜单,全球区块链50强
全球物流企业50强,全球物流企业50强
国家企业技术中心,国家企业技术中心
国家制造业单项冠军,国家制造业单项冠军
最具价值公司榜,最具价值公司
标准起草单位,标准起草单位
瞪羚企业,瞪羚企业
科技型中小企业,科技型中小企业
财富世界500强,财富世界500强
金融租赁公司排名,金融租赁公司
驰名保护,驰名保护
驰名商标,驰名商标
高新技术企业,高新技术企业